{
  "title": "Custom Roles Cannot Be Reused Across Multiple Stacks Simultaneously",
  "slug": "custom-roles-cannot-be-reused-across-multiple-stacks-simultaneously",
  "pod": "CMS - UI",
  "section": "Content Editing & UI Workflows",
  "order": 6,
  "status": "published-in-drive",
  "source_case_id": null,
  "contentstack_entry_uid": null,
  "confidence_score": null,
  "keywords": [],
  "alternate_search_terms": [],
  "related_articles": [],
  "traceability": {
    "migrated_from": "CMS - UI (main, Jun 21 2026)",
    "migrated_on": "2026-07-08",
    "pipeline": "gdocs-migration-v1"
  }
}
