{
  "title": "SSO User Accounts Advance to Accepted State Without Completing a Login",
  "slug": "sso-user-accounts-advance-to-accepted-state-without-completing-a-login",
  "pod": "AUTH",
  "section": "Authentication & Login",
  "order": 4,
  "status": "published-in-drive",
  "source_case_id": null,
  "contentstack_entry_uid": null,
  "confidence_score": null,
  "keywords": [],
  "alternate_search_terms": [],
  "related_articles": [],
  "traceability": {
    "migrated_from": "AUTH (main, Jun 21 2026)",
    "migrated_on": "2026-07-08",
    "pipeline": "gdocs-migration-v1"
  }
}
