{
  "title": ".NET SDK Migration to System.Text.Json \u2013 Beta Packages Available",
  "slug": "net-sdk-migration-to-system-text-json-beta-packages-available",
  "pod": "General",
  "section": "API Delivery, GraphQL & Assets",
  "order": 2,
  "status": "published-in-drive",
  "source_case_id": null,
  "contentstack_entry_uid": null,
  "confidence_score": null,
  "keywords": [],
  "alternate_search_terms": [],
  "related_articles": [],
  "traceability": {
    "migrated_from": "General Additions (Jun 28 2026)",
    "migrated_on": "2026-07-08",
    "pipeline": "gdocs-migration-v1"
  }
}
