{
  "title": "Invited User Cannot Log In to an SSO Organization \u2014 Must Use SSO Landing Page",
  "slug": "invited-user-cannot-log-in-to-an-sso-organization-must-use-sso-landing-page",
  "pod": "AUTH",
  "section": "Authentication & Login",
  "order": 3,
  "status": "published-in-drive",
  "source_case_id": null,
  "contentstack_entry_uid": null,
  "confidence_score": null,
  "keywords": [],
  "alternate_search_terms": [],
  "related_articles": [],
  "traceability": {
    "migrated_from": "AUTH (main, Jun 21 2026)",
    "migrated_on": "2026-07-08",
    "pipeline": "gdocs-migration-v1"
  }
}
