{
  "title": "SSO Certificate Renewal Blocked When Original Organization Owner Has Left",
  "slug": "sso-certificate-renewal-blocked-when-original-organization-owner-has-left",
  "pod": "AUTH",
  "section": "Authentication & Login",
  "order": 2,
  "status": "published-in-drive",
  "source_case_id": null,
  "contentstack_entry_uid": null,
  "confidence_score": null,
  "keywords": [],
  "alternate_search_terms": [],
  "related_articles": [],
  "traceability": {
    "migrated_from": "AUTH (main, Jun 21 2026)",
    "migrated_on": "2026-07-08",
    "pipeline": "gdocs-migration-v1"
  }
}
