{
  "title": "Entry Search Results Delayed After Bulk Migration Import",
  "slug": "entry-search-results-delayed-after-bulk-migration-import",
  "pod": "CMS - UI",
  "section": "Content Editing & UI Workflows",
  "order": 7,
  "status": "published-in-drive",
  "source_case_id": null,
  "contentstack_entry_uid": null,
  "confidence_score": null,
  "keywords": [],
  "alternate_search_terms": [],
  "related_articles": [],
  "traceability": {
    "migrated_from": "CMS - UI Additions (Jun 28 2026)",
    "migrated_on": "2026-07-08",
    "pipeline": "gdocs-migration-v1"
  }
}
