{
  "title": "Custom Field Stops Persisting Data After App SDK Upgrade",
  "slug": "custom-field-stops-persisting-data-after-app-sdk-upgrade",
  "pod": "CMS - UI",
  "section": "Custom Extensions, Live Preview & Analytics",
  "order": 2,
  "status": "published-in-drive",
  "source_case_id": null,
  "contentstack_entry_uid": null,
  "confidence_score": null,
  "keywords": [],
  "alternate_search_terms": [],
  "related_articles": [],
  "traceability": {
    "migrated_from": "CMS - UI (main, Jun 21 2026)",
    "migrated_on": "2026-07-08",
    "pipeline": "gdocs-migration-v1"
  }
}
