{
  "title": "XTM Translation App Experiences Intermittent Delivery Failures on Large Batches",
  "slug": "xtm-translation-app-experiences-intermittent-delivery-failures-on-large-batches",
  "pod": "Marketplace - Public Apps",
  "section": "Webhooks & External Integrations",
  "order": 1,
  "status": "published-in-drive",
  "source_case_id": null,
  "contentstack_entry_uid": null,
  "confidence_score": null,
  "keywords": [],
  "alternate_search_terms": [],
  "related_articles": [],
  "traceability": {
    "migrated_from": "Marketplace - Public Apps (main, Jun 21 2026)",
    "migrated_on": "2026-07-08",
    "pipeline": "gdocs-migration-v1"
  }
}
