{
  "title": "Application Interface Stuck on Loading Spinner After Successful Login",
  "slug": "application-interface-stuck-on-loading-spinner-after-successful-login",
  "pod": "AUTH",
  "section": "Authentication & Login",
  "order": 6,
  "status": "published-in-drive",
  "source_case_id": null,
  "contentstack_entry_uid": null,
  "confidence_score": null,
  "keywords": [],
  "alternate_search_terms": [],
  "related_articles": [],
  "traceability": {
    "migrated_from": "AUTH Additions (Jun 28 2026)",
    "migrated_on": "2026-07-08",
    "pipeline": "gdocs-migration-v1"
  }
}
