{
  "title": "Deleted Assets Remain Counted Against the Stack Asset Limit Until Trash Is Purged",
  "slug": "deleted-assets-remain-counted-against-the-stack-asset-limit-until-trash-is-purge",
  "pod": "CMS - UI",
  "section": "Content Editing & UI Workflows",
  "order": 5,
  "status": "published-in-drive",
  "source_case_id": null,
  "contentstack_entry_uid": null,
  "confidence_score": null,
  "keywords": [],
  "alternate_search_terms": [],
  "related_articles": [],
  "traceability": {
    "migrated_from": "CMS - UI (main, Jun 21 2026)",
    "migrated_on": "2026-07-08",
    "pipeline": "gdocs-migration-v1"
  }
}
