{
  "title": "Custom App URL Resolver Not Loading in Entry Editor",
  "slug": "custom-app-url-resolver-not-loading-in-entry-editor",
  "pod": "Launch",
  "section": "Custom Extensions, Live Preview & Analytics",
  "order": 2,
  "status": "published-in-drive",
  "source_case_id": null,
  "contentstack_entry_uid": null,
  "confidence_score": null,
  "keywords": [],
  "alternate_search_terms": [],
  "related_articles": [],
  "traceability": {
    "migrated_from": "Launch Additions (Jun 28 2026)",
    "migrated_on": "2026-07-08",
    "pipeline": "gdocs-migration-v1"
  }
}
