{
  "title": "Visual Builder and Live Preview Break on Pages with Anchor Tag Navigation",
  "slug": "visual-builder-and-live-preview-break-on-pages-with-anchor-tag-navigation",
  "pod": "CMS - UI",
  "section": "Custom Extensions, Live Preview & Analytics",
  "order": 3,
  "status": "published-in-drive",
  "source_case_id": null,
  "contentstack_entry_uid": null,
  "confidence_score": null,
  "keywords": [],
  "alternate_search_terms": [],
  "related_articles": [],
  "traceability": {
    "migrated_from": "CMS - UI Additions (Jun 28 2026)",
    "migrated_on": "2026-07-08",
    "pipeline": "gdocs-migration-v1"
  }
}
