{
  "title": "Polaris AI Feature \u2014 Capabilities, Credit Allocation, and Data Compliance Overview",
  "slug": "polaris-ai-feature-capabilities-credit-allocation-and-data-compliance-overview",
  "pod": "Marketplace - Public Apps",
  "section": "Content Editing & UI Workflows",
  "order": 1,
  "status": "published-in-drive",
  "source_case_id": null,
  "contentstack_entry_uid": null,
  "confidence_score": null,
  "keywords": [],
  "alternate_search_terms": [],
  "related_articles": [],
  "traceability": {
    "migrated_from": "Marketplace - Public Apps (main, Jun 21 2026)",
    "migrated_on": "2026-07-08",
    "pipeline": "gdocs-migration-v1"
  }
}
